doc_id;datetime;text;media;alt_text;likes;reposts;replies;username;handle;user_description;user_image;user_followers;commented_post;sponsored;target;condition;sequence
38;19.06.24 10:49;Seeing news about water-borne diseases spreading in flood-hit areas of Brazil is terrifying. The government and international community need to act fast to prevent a health crisis.;;;22;3;8;Brendan;Grundla;Travel blogger and adventure seeker. Join me as I explore new destinations and share travel tips.;https://images.unsplash.com/photo-1548048876-54a717fa3f8c?q=80&w=3840&auto=format&fit=crop&ixlib=rb-4.0.3&ixid=M3wxMjA3fDB8MHxwaG90by1wYWdlfHx8fGVufDB8fHx8fA%3D%3D;346;0;0;;A_2;37
39;19.06.24 10:52;"Carnaval celebrations across Brazil are legendary – whether it's samba rhythms or frevo dances; each city brings its unique flavor into this grand festival!";;;22;4;3;Emily Wilson;emilyhwilson;Artist and creative soul. Sharing my artwork, creative process, and inspiration.;https://images.unsplash.com/photo-1509868918748-a554ad25f858?q=80&w=3875&auto=format&fit=crop&ixlib=rb-4.0.3&ixid=M3wxMjA3fDB8MHxwaG90by1wYWdlfHx8fGVufDB8fHx8fA%3D%3D;283;0;0;;A_2;38
40;19.06.24 10:55;If you’re planning your next vacation once travel restrictions ease up—consider exploring tropical islands around Brazil—they're perfect for relaxing downtime away from chaos 🏝️🌞;;;0;3;7;Mrs. Nobody;Niru11apr;Mental health advocate and wellness coach. Tips on mindfulness, self-care, and mental well-being.;https://images.unsplash.com/photo-1546422832-de5b9c2042f6?q=80&w=1856&auto=format&fit=crop&ixlib=rb-4.0.3&ixid=M3wxMjA3fDB8MHxwaG90by1wYWdlfHx8fGVufDB8fHx8fA%3D%3D;703;0;0;;A_2;39
41;19.06.24 10:58;"So proud that Raphinha stood up against criticism from legends like Ronaldinho; shows how much he believes in our current squad’s potential despite setbacks & challenges ahead!";;;14;1;0;Tyler Batiste;TyBatiste;Sports fanatic and baseball aficionado. Sharing game highlights, player stats, and sports commentary.;https://images.unsplash.com/photo-1513956589380-bad6acb9b9d4?q=80&w=1536&auto=format&fit=crop&ixlib=rb-4.0.3&ixid=M3wxMjA3fDB8MHxwaG90by1wYWdlfHx8fGVufDB8fHx8fA%3D%3D;600;0;0;;A_2;40
42;19.06.24 11:01;The IFRC is calling for more support for flood victims in Brazil as they face worsening conditions with more rain on the way. Let’s not forget about these struggling communities.;;;25;7;23;naimisha;1306_naimisha;Fashion & Lifestyle.;https://images.unsplash.com/photo-1627393100177-b4297e79a5be?q=80&w=3880&auto=format&fit=crop&ixlib=rb-4.0.3&ixid=M3wxMjA3fDB8MHxwaG90by1wYWdlfHx8fGVufDB8fHx8fA%3D%3D;535;0;0;;A_2;41
43;19.06.24 11:04;Envisioning serene getaways amidst lush environments knowing currently grappling impacts prolonged inclement conditions reminds importance staying united offering unwavering solidarity ensuring smoother recoveries ahead together stronger always!.#GlobalFamily;;;34;5;19;Francisco Orcha;orcha_f;Tech entrepreneur and innovator. Sharing insights on startups, technology, and business growth.;https://images.unsplash.com/photo-1519085360753-af0119f7cbe7?q=80&w=3774&auto=format&fit=crop&ixlib=rb-4.0.3&ixid=M3wxMjA3fDB8MHxwaG90by1wYWdlfHx8fGVufDB8fHx8fA%3D%3D;42;0;0;;A_2;43
44;19.06.24 11:07;"""""Though in many ways it feels like day one"""" – this line from IFRC really hit hard... can't fathom what they're going through four weeks into this emergency 😢";;;14;7;2;Rohit H B;HBRohit;Hobby Geek.;https://images.unsplash.com/photo-1615862915913-b93d20d742a3?q=80&w=3774&auto=format&fit=crop&ixlib=rb-4.0.3&ixid=M3wxMjA3fDB8MHxwaG90by1wYWdlfHx8fGVufDB8fHx8fA%3D%3D;348;0;0;;A_2;44
45;19.06.24 11:10;Just read that floodwaters are trapping aid from getting to those who need it most in Brazil... we really need a miracle here to help these poor people out!;;;17;6;20;Michael John Smith;londonerabroad1;Travel blogger and adventure seeker.;https://images.unsplash.com/photo-1605827277785-2c51c2b3182b?q=80&w=3870&auto=format&fit=crop&ixlib=rb-4.0.3&ixid=M3wxMjA3fDB8MHxwaG90by1wYWdlfHx8fGVufDB8fHx8fA%3D%3D;390;0;0;;A_2;45
46;19.06.24 11:13;Ronaldinho boycotting Copa América because he thinks this year's team lacks grit? Ouch, that’s some tough love! Hope the players use this as motivation to prove him wrong.;;;24;8;13;taco;TacoTheMeme;Meme creator and humor enthusiast. Bringing you daily laughs and viral memes.;https://images.unsplash.com/photo-1631885628726-d60689c330db?q=80&w=3205&auto=format&fit=crop&ixlib=rb-4.0.3&ixid=M3wxMjA3fDB8MHxwaG90by1wYWdlfHx8fGVufDB8fHx8fA%3D%3D;304;0;0;;A_2;46
47;19.06.24 11:16;Brazil has faced adversity before & they'll do it again… sending strength & positivity their way as they recover from devastating floods 🙏🌊;;;24;7;10;Kim Brown;_KBrown401;Sports fanatic and baseball aficionado. Sharing game highlights, player stats, and sports commentary.;https://images.unsplash.com/photo-1630255733678-cf82ac59eef8?q=80&w=2493&auto=format&fit=crop&ixlib=rb-4.0.3&ixid=M3wxMjA3fDB8MHxwaG90by1wYWdlfHx8fGVufDB8fHx8fA%3D%3D;290;0;0;;A_2;47
48;19.06.24 11:19;Just read about the ongoing rains and cold temperatures in southern Brazil after the flooding. The humanitarian crisis is worsening, and it’s crucial we keep providing aid and support to those in need.;;;30;2;1;Brad Ruiters;braddo_ct;Fitness coach and wellness advocate. Motivating you to achieve your health goals with tips and workout routines.;https://images.unsplash.com/photo-1529688530647-93a6e1916f5f?q=80&w=2498&auto=format&fit=crop&ixlib=rb-4.0.3&ixid=M3wxMjA3fDB8MHxwaG90by1wYWdlfHx8fGVufDB8fHx8fA%3D%3D;132;0;0;;A_2;48
49;19.06.24 11:22;Just read about the devastating floods in southern Brazil affecting millions of people. Can't believe the scale of this tragedy. Praying for everyone affected and hoping aid reaches them soon. 🙏;;;16;2;13;Funny Vines;FunyyVines;Comedy lover and vine enthusiast. Sharing the funniest vines and comedy clips.;https://images.unsplash.com/photo-1628127468187-b5adce92a995?q=80&w=3870&auto=format&fit=crop&ixlib=rb-4.0.3&ixid=M3wxMjA3fDB8MHxwaG90by1wYWdlfHx8fGVufDB8fHx8fA%3D%3D;328;0;0;;A_2;49
50;19.06.24 11:25;Just read about the devastating floods in southern Brazil affecting millions of people. Can't believe the scale of this tragedy. Praying for everyone affected and hoping aid reaches those in need ASAP.;;;38;6;1;Samir Madani;Samir_Madani;Tech geek and gadget reviewer. Bringing you the latest in tech news and reviews.;https://images.unsplash.com/photo-1529111290557-82f6d5c6cf85?q=80&w=2848&auto=format&fit=crop&ixlib=rb-4.0.3&ixid=M3wxMjA3fDB8MHxwaG90by1wYWdlfHx8fGVufDB8fHx8fA%3D%3D;52;0;0;;A_2;50
51;19.06.24 11:28;Brazil is such a beautiful country with its white-sand beaches and lush rainforests, but it's heartbreaking to see it struggle with natural disasters like these floods. We need to support them!;;;40;6;5;Lobna Darwish;lobna;Artist and creative soul. Sharing my artwork, creative process, and inspiration.;https://images.unsplash.com/photo-1544005313-94ddf0286df2?q=80&w=3776&auto=format&fit=crop&ixlib=rb-4.0.3&ixid=M3wxMjA3fDB8MHxwaG90by1wYWdlfHx8fGVufDB8fHx8fA%3D%3D;335;0;0;;A_2;51
52;19.06.24 11:31;The rainy season in southern Brazil has turned into a humanitarian crisis with millions affected by floods. IFRC is urging continued support as conditions worsen with cold weather and diseases.;;;9;8;13;Marcia Maddocks;MaddocksMarcia;Mental health advocate and wellness coach. Tips on mindfulness, self-care, and mental well-being.;https://images.unsplash.com/photo-1604072366595-e75dc92d6bdc?q=80&w=3840&auto=format&fit=crop&ixlib=rb-4.0.3&ixid=M3wxMjA3fDB8MHxwaG90by1wYWdlfHx8fGVufDB8fHx8fA%3D%3D;668;0;0;;A_2;52
53;19.06.24 11:34;Southern Brazil needs our support now more than ever with ongoing rains worsening an already dire situation post-floods... Let's not forget about them as they rebuild their lives.;;;30;7;11;gweezy;georgia12210;Music lover and aspiring artist. Sharing my musical journey and favorite tunes.;https://images.unsplash.com/photo-1502823403499-6ccfcf4fb453?q=80&w=2000&auto=format&fit=crop&ixlib=rb-4.0.3&ixid=M3wxMjA3fDB8MHxwaG90by1wYWdlfHx8fGVufDB8fHx8fA%3D%3D;438;0;0;;A_2;53
54;19.06.24 11:37;The Amazon rainforest is truly one of nature's greatest wonders, but it's also so vulnerable to climate change and deforestation. Let's do our part in preserving this incredible ecosystem.;;;37;1;3;Lia mahdalena;liamhdlenaa;Fashion enthusiast and lifestyle blogger. Follow for style tips, beauty hacks, and daily inspiration.;https://images.unsplash.com/photo-1607569708758-0270aa4651bd?q=80&w=3774&auto=format&fit=crop&ixlib=rb-4.0.3&ixid=M3wxMjA3fDB8MHxwaG90by1wYWdlfHx8fGVufDB8fHx8fA%3D%3D;204;0;0;;A_2;55
55;19.06.24 11:40;White-sand beaches might call us back when times are better but right now those stunning coastal areas need our help recovering from catastrophic flood damages.#HelpBrazilRecover;;;25;2;3;Apok842;apok842;Gaming enthusiast and streamer. Join me for live streams, game reviews, and gaming tips.;https://images.unsplash.com/photo-1603384699007-50799748fc45?q=80&w=2545&auto=format&fit=crop&ixlib=rb-4.0.3&ixid=M3wxMjA3fDB8MHxwaG90by1wYWdlfHx8fGVufDB8fHx8fA%3D%3D;387;0;0;;A_2;56
56;19.06.24 11:43;Southern Brazil needs our help now more than ever – continuous rains, cold temperatures, and water-borne diseases are making recovery efforts extremely challenging.;;;26;1;11;Melissa Phillips;migratorymel;Travel blogger.;https://images.unsplash.com/photo-1644358731331-34756cbb64b5?q=80&w=3526&auto=format&fit=crop&ixlib=rb-4.0.3&ixid=M3wxMjA3fDB8MHxwaG90by1wYWdlfHx8fGVufDB8fHx8fA%3D%3D;731;0;0;;A_2;57
57;19.06.24 11:46;Brazil offers incredible experiences – from dancing samba at Rio Carnival or exploring Amazon rainforest – let’s cherish these while also supporting communities hit hard by recent natural disasters.#DualSupport;;;39;7;22;Alex Morritt;Alex_Morritt;Writer and storyteller. Sharing my literary works, writing tips, and book reviews.;https://images.unsplash.com/photo-1520341280432-4749d4d7bcf9?q=80&w=3648&auto=format&fit=crop&ixlib=rb-4.0.3&ixid=M3wxMjA3fDB8MHxwaG90by1wYWdlfHx8fGVufDB8fHx8fA%3D%3D;385;0;0;;A_2;58
58;19.06.24 11:49;Brazil is such a beautiful country with its beaches, rainforests, and vibrant cities. Hoping the floods don’t ruin too much of its natural beauty and culture.;;;35;1;8;Kerala_WithRG;KeralaWithRG;Travel blogger and adventure seeker. Join me as I explore new destinations and share travel tips.;https://images.unsplash.com/photo-1489424731084-a5d8b219a5bb?q=80&w=3774&auto=format&fit=crop&ixlib=rb-4.0.3&ixid=M3wxMjA3fDB8MHxwaG90by1wYWdlfHx8fGVufDB8fHx8fA%3D%3D;478;0;0;;A_2;59
59;19.06.24 11:52;From white-sand beaches to verdant rainforests - Lonely Planet paints a beautiful picture but let's remember parts of Brazil are suffering right now due to catastrophic flooding.;;;24;1;4;Umesh Rai;umesh2063;Tech enthusiast and software developer. Sharing coding tips, tech news, and innovative projects.;https://images.unsplash.com/photo-1530268729831-4b0b9e170218?q=80&w=3870&auto=format&fit=crop&ixlib=rb-4.0.3&ixid=M3wxMjA3fDB8MHxwaG90by1wYWdlfHx8fGVufDB8fHx8fA%3D%3D;810;0;0;;A_2;60
60;19.06.24 11:55;My heart goes out to those suffering from water-borne diseases due to flooding in southern Brazil... This crisis needs more attention globally so we can bring effective relief efforts there!;;;34;0;6;Anggun History;AnggunHistory;History buff and writer. Sharing historical facts, stories, and insights.;https://images.unsplash.com/photo-1632759200868-ed04ef0bb2dc?q=80&w=3774&auto=format&fit=crop&ixlib=rb-4.0.3&ixid=M3wxMjA3fDB8MHxwaG90by1wYWdlfHx8fGVufDB8fHx8fA%3D%3D;441;0;0;;A_2;61
61;19.06.24 11:58;Let’s keep promoting tourism while being mindful that some regions face dire situations – remembering both sides helps maintain empathy along with enthusiasm for visiting places like Brazil.#BalancedView;;;4;0;12;Jill Colvin Jones;jillcolvinjones;Journalist and news reporter. Bringing you the latest news, stories, and in-depth analysis.;https://images.unsplash.com/photo-1529232356377-57971f020a94?q=80&w=3776&auto=format&fit=crop&ixlib=rb-4.0.3&ixid=M3wxMjA3fDB8MHxwaG90by1wYWdlfHx8fGVufDB8fHx8fA%3D%3D;688;0;0;;A_2;62
62;19.06.24 12:01;Flooding aftermath impacting countless lives down south reminds us importance being prepared emergencies while also highlighting crucial role international aid plays during such times crisis…;;;32;4;0;B L V C K;Blvck000;Fashion enthusiast and lifestyle blogger. Follow for style tips, beauty hacks, and daily inspiration.;https://images.unsplash.com/photo-1523477800337-966dbabe060b?q=80&w=2008&auto=format&fit=crop&ixlib=rb-4.0.3&ixid=M3wxMjA3fDB8MHxwaG90by1wYWdlfHx8fGVufDB8fHx8fA%3D%3D;288;0;0;;A_2;63
1;08.05.24 09:30;Ad A;https://images.unsplash.com/photo-1577974291737-faf660945d53?q=80&w=3274&auto=format&fit=crop&ixlib=rb-4.0.3&ixid=M3wxMjA3fDB8MHxwaG90by1wYWdlfHx8fGVufDB8fHx8fA%3D%3D;Letter A;336;52;9;Brand A;brand_A;Official global account.;https://images.unsplash.com/photo-1516876437184-593fda40c7ce?q=80&w=3272&auto=format&fit=crop&ixlib=rb-4.0.3&ixid=M3wxMjA3fDB8MHxwaG90by1wYWdlfHx8fGVufDB8fHx8fA%3D%3D;2223756;0;1;;A_3;
2;08.05.24 09:30;In the aftermath of the floods in Brazil, thousands have found temporary shelter. Every donation helps provide essentials to those in need. Support our efforts to bring relief. Donate now. <br>#HelpBrazil #BrazilFloodRelief;https://raw.githubusercontent.com/Howquez/oFeeds/main/studies/frequency_capping/stimuli/images/creative_A.png;Crowded indoor shelter with people on scattered mattresses after a flood in Brazil.;336;52;9;UNICEF;UNICEF;UNICEF works in over 190 countries and territories to protect children's rights. We won't stop, #ForEveryChild.;https://fa.oregonstate.edu/sites/fa.oregonstate.edu/files/223-2237995_unicef-logo-unicef-logo-png-high-resolution-unicef_1_.webp;9243872;0;1;https://help.unicef.org/brazil-floods/citi-foundation?language=en;A_3;
3;08.05.24 09:30;In the aftermath of the floods in Brazil, thousands have found temporary shelter. Every donation helps provide essentials to those in need. Support our efforts to bring relief. Donate now. <br>#HelpBrazil #BrazilFloodRelief;https://raw.githubusercontent.com/Howquez/oFeeds/main/studies/frequency_capping/stimuli/images/creative_A.png;Crowded indoor shelter with people on scattered mattresses after a flood in Brazil.;336;52;9;UNICEF;UNICEF;UNICEF works in over 190 countries and territories to protect children's rights. We won't stop, #ForEveryChild.;https://fa.oregonstate.edu/sites/fa.oregonstate.edu/files/223-2237995_unicef-logo-unicef-logo-png-high-resolution-unicef_1_.webp;9243872;0;1;https://help.unicef.org/brazil-floods/citi-foundation?language=en;A_3;
4;08.05.24 09:30;In the aftermath of the floods in Brazil, thousands have found temporary shelter. Every donation helps provide essentials to those in need. Support our efforts to bring relief. Donate now. <br>#HelpBrazil #BrazilFloodRelief;https://raw.githubusercontent.com/Howquez/oFeeds/main/studies/frequency_capping/stimuli/images/creative_A.png;Crowded indoor shelter with people on scattered mattresses after a flood in Brazil.;336;52;9;UNICEF;UNICEF;UNICEF works in over 190 countries and territories to protect children's rights. We won't stop, #ForEveryChild.;https://fa.oregonstate.edu/sites/fa.oregonstate.edu/files/223-2237995_unicef-logo-unicef-logo-png-high-resolution-unicef_1_.webp;9243872;0;1;https://help.unicef.org/brazil-floods/citi-foundation?language=en;A_3;
5;19.06.24 09:10;Magical escapades await exploring tropical paradises future meantime acknowledging realities facing numerous communities dealing unprecedented challenges critical maintaining balanced perspectives fostering genuine connections globally!.#HeartfeltSupport;;;6;5;2;welmar du plessis;Welmardup;Adventurer and nature lover. Sharing my travels and outdoor experiences. Expect stunning landscapes and travel tips.;https://images.unsplash.com/photo-1606115690424-49770e55a2bc?q=80&w=3648&auto=format&fit=crop&ixlib=rb-4.0.3&ixid=M3wxMjA3fDB8MHxwaG90by1wYWdlfHx8fGVufDB8fHx8fA%3D%3D;567;0;0;;A_3;1
6;19.06.24 09:13;Samba drums calling my name! Rio during Carnaval must be an experience like no other… someday I'll join those wild rhythm-filled metropolises 🎉;;;15;1;17;aurelie rabiot;zouzoum44;Fashion enthusiast and lifestyle blogger. Follow for style tips, beauty hacks, and daily inspiration.;https://images.unsplash.com/photo-1611432579699-484f7990b127?q=80&w=3870&auto=format&fit=crop&ixlib=rb-4.0.3&ixid=M3wxMjA3fDB8MHxwaG90by1wYWdlfHx8fGVufDB8fHx8fA%3D%3D;419;0;0;;A_3;2
7;19.06.24 09:16;Can’t wait for Copa América despite Ronaldinho’s harsh words about our national team... I have faith they'll rise above it all and make us proud!;;;27;0;17;Leo Lozano;lozano1931;Tech geek and gadget reviewer. Bringing you the latest in tech news and reviews. Stay updated with cutting-edge technology.;https://images.unsplash.com/photo-1633332755192-727a05c4013d?q=80&w=3880&auto=format&fit=crop&ixlib=rb-4.0.3&ixid=M3wxMjA3fDB8MHxwaG90by1wYWdlfHx8fGVufDB8fHx8fA%3D%3D;460;0;0;;A_3;3
8;19.06.24 09:19;The Brazilian flood crisis continues as floodwaters remain trapped, making it hard to distribute aid or let people return home. More rain and colder weather are expected too - we must help!;;;32;4;21;kevin;ihearthalladay;Sports fanatic and baseball aficionado. Sharing game highlights, player stats, and sports commentary.;https://images.unsplash.com/photo-1595211877493-41a4e5f236b3?q=80&w=3830&auto=format&fit=crop&ixlib=rb-4.0.3&ixid=M3wxMjA3fDB8MHxwaG90by1wYWdlfHx8fGVufDB8fHx8fA%3D%3D;168;0;0;;A_3;4
9;19.06.24 09:22;"Despite facing criticisms left right center from football icons alike Ronaldinho himself; current crop players representing beloved nation remain steadfastly committed proving doubters wrong field!!";;;23;7;12;max saber;spencylund;Fitness coach and wellness advocate. Motivating you to achieve your health goals with tips and workout routines.;https://images.unsplash.com/photo-1629425733761-caae3b5f2e50?q=80&w=2968&auto=format&fit=crop&ixlib=rb-4.0.3&ixid=M3wxMjA3fDB8MHxwaG90by1wYWdlfHx8fGVufDB8fHx8fA%3D%3D;720;0;0;;A_3;5
10;19.06.24 09:25;The diverse cultures within Brazil are truly amazing—from indigenous traditions to immigrant influences—it really is a melting pot unlike any other 🌍;;;9;6;20;bowdi;bowdi;Music lover and aspiring artist. Sharing my musical journey and favorite tunes. Join me for some great music vibes.;https://images.unsplash.com/photo-1540569014015-19a7be504e3a?q=80&w=3024&auto=format&fit=crop&ixlib=rb-4.0.3&ixid=M3wxMjA3fDB8MHxwaG90by1wYWdlfHx8fGVufDB8fHx8fA%3D%3D;179;0;0;;A_3;7
11;19.06.24 09:28;Heartbreaking scenes from southern Brazil where floods have affected over 2.3 million people. IFRC is calling for more support as rains and water-borne diseases continue to wreak havoc. We need to help!;;;3;7;10;Dierenthuis;dierenthuis;Animal lover and pet care expert. Tips on pet health, training, and adorable pet moments.;https://images.unsplash.com/photo-1494790108377-be9c29b29330?q=80&w=3744&auto=format&fit=crop&ixlib=rb-4.0.3&ixid=M3wxMjA3fDB8MHxwaG90by1wYWdlfHx8fGVufDB8fHx8fA%3D%3D;235;0;0;;A_3;8
12;19.06.24 09:31;Feeling blessed having never experienced anything close to what flood victims are going through right now… let's show them some humanity & compassion 🙏❤️ #BrazilFloodsResponse;;;3;1;3;JM;b5forks;Foodie and culinary explorer. Discovering new recipes, restaurant reviews, and food adventures.;https://images.unsplash.com/photo-1500648767791-00dcc994a43e?q=80&w=3000&auto=format&fit=crop&ixlib=rb-4.0.3&ixid=M3wxMjA3fDB8MHxwaG90by1wYWdlfHx8fGVufDB8fHx8fA%3D%3D;641;0;0;;A_3;9
13;19.06.24 09:34;Whether planning adventure through Amazon parties once safe again meantime directing energies aiding recovery efforts showcases collective commitment ensuring brighter days return soonest possible!.#HopeForBetterTomorrow;;;12;8;10;C0urtesy tiTus;C0urtesyTitus;Gaming enthusiast and streamer. Join me for live streams, game reviews, and gaming tips.;https://images.unsplash.com/photo-1507003211169-0a1dd7228f2d?q=80&w=3569&auto=format&fit=crop&ixlib=rb-4.0.3&ixid=M3wxMjA3fDB8MHxwaG90by1wYWdlfHx8fGVufDB8fHx8fA%3D%3D;558;0;0;;A_3;10
14;19.06.24 09:37;A month after severe flooding began in southern Brazil, over 2 million people are still grappling with the aftermath as floodwaters remain trapped in many areas, hampering relief efforts.;;;28;2;23;Kinzang Norbu;KinzanNobu;Cultural explorer and travel blogger. Sharing stories and photos from my global adventures.;https://images.unsplash.com/photo-1472099645785-5658abf4ff4e?q=80&w=3870&auto=format&fit=crop&ixlib=rb-4.0.3&ixid=M3wxMjA3fDB8MHxwaG90by1wYWdlfHx8fGVufDB8fHx8fA%3D%3D;180;0;0;;A_3;11
15;19.06.24 09:40;Brazil’s national pride shines brightly through passionate support seen amongst fans everywhere cheering tirelessly regardless outcome matches played during major tournaments alike Copa America etc…;;;0;1;11;Gian B;IamGian24;Fitness enthusiast and personal trainer. Helping you achieve your fitness goals with tips and motivation.;https://images.unsplash.com/photo-1620932934088-fbdb2920e484?q=80&w=2426&auto=format&fit=crop&ixlib=rb-4.0.3&ixid=M3wxMjA3fDB8MHxwaG90by1wYWdlfHx8fGVufDB8fHx8fA%3D%3D;315;0;0;;A_3;12
16;19.06.24 09:43;Southern Brazil needs our prayers and support more than ever with ongoing rains and cold temperatures making recovery even harder after the floods.;;;8;6;6;Victor Peetso;VWPeetso;Automotive expert and car enthusiast. Reviews, tips, and news about the latest in the automotive world.;https://images.unsplash.com/photo-1558222218-b7b54eede3f3?q=80&w=3774&auto=format&fit=crop&ixlib=rb-4.0.3&ixid=M3wxMjA3fDB8MHxwaG90by1wYWdlfHx8fGVufDB8fHx8fA%3D%3D;351;0;0;;A_3;13
17;19.06.24 09:46;"Reading about beautiful beaches & rainforests while knowing parts suffer due to floods seems surreal; let’s balance our admiration with compassion & active support for those affected.#PrayForBrazil";;;39;2;6;Oguntuyi Itunuoluwa;IT_Oluwa;Tech enthusiast and software developer. Sharing coding tips, tech news, and innovative projects.;https://images.unsplash.com/photo-1600878459138-e1123b37cb30?q=80&w=3812&auto=format&fit=crop&ixlib=rb-4.0.3&ixid=M3wxMjA3fDB8MHxwaG90by1wYWdlfHx8fGVufDB8fHx8fA%3D%3D;332;0;0;;A_3;14
18;19.06.24 09:49;IFRC says it feels like day one even though it's been a month since the floods hit southern Brazil. Water levels haven't receded, making it hard to deliver humanitarian aid. Prayers for everyone affected.;;;38;7;13;Ariunchimeg Viktor;AnyaVik;Artist and creative soul. Sharing my artwork, creative process, and inspiration.;https://images.unsplash.com/photo-1598886221209-99421ca9452e?q=80&w=2832&auto=format&fit=crop&ixlib=rb-4.0.3&ixid=M3wxMjA3fDB8MHxwaG90by1wYWdlfHx8fGVufDB8fHx8fA%3D%3D;70;0;0;;A_3;15
19;19.06.24 09:52;It's been four weeks since floods devastated southern Brazil but it's still an emergency situation according to IFRC officials who warn that more rainfall could worsen things further.;;;30;3;15;Chill Pill;soreia_kh;Mental health advocate and wellness coach. Tips on mindfulness, self-care, and mental well-being.;https://images.unsplash.com/photo-1607569490015-7101095605ed?q=80&w=3774&auto=format&fit=crop&ixlib=rb-4.0.3&ixid=M3wxMjA3fDB8MHxwaG90by1wYWdlfHx8fGVufDB8fHx8fA%3D%3D;822;0;0;;A_3;16
20;19.06.24 09:55;Raphinha showing solidarity with his teammates after Ronaldinho's harsh comments is what true leadership looks like. Criticism is part of the game, but unity will get them through! Vamos Brasil!;;;13;6;8;WF OMAR;Arowoshaye;Entrepreneur and business strategist. Sharing insights on business growth, leadership, and innovation.;https://images.unsplash.com/photo-1560250097-0b93528c311a?q=80&w=3149&auto=format&fit=crop&ixlib=rb-4.0.3&ixid=M3wxMjA3fDB8MHxwaG90by1wYWdlfHx8fGVufDB8fHx8fA%3D%3D;209;0;0;;A_3;17
21;19.06.24 09:58;Samba rhythms may fill hearts during Carnaval yet today many Brazilians deal with aftermaths of relentless rains causing widespread damage – sending love & hope their way.#UnitedInAdversity;;;21;6;1;Darnell Baldwin;Nell_emAll;Music producer and DJ. Bringing you the latest beats, mixes, and music industry news.;https://images.unsplash.com/photo-1603871165848-0aa92c869fa1?q=80&w=3772&auto=format&fit=crop&ixlib=rb-4.0.3&ixid=M3wxMjA3fDB8MHxwaG90by1wYWdlfHx8fGVufDB8fHx8fA%3D%3D;42;0;0;;A_3;19
22;19.06.24 10:01;"It's crazy how quickly one natural disaster can change everything... one month ago life was normal for millions in southern Brazil; now they're dealing with displacement and disease 😔";;;31;1;10;Allen Drazila;Allendrizzle;Travel blogger and adventure seeker. Join me as I explore new destinations and share travel tips.;https://images.unsplash.com/photo-1600486913747-55e5470d6f40?q=80&w=3870&auto=format&fit=crop&ixlib=rb-4.0.3&ixid=M3wxMjA3fDB8MHxwaG90by1wYWdlfHx8fGVufDB8fHx8fA%3D%3D;22;0;0;;A_3;20
23;19.06.24 10:04;Gritty show of unity from Raphinha backing his team amidst Ronaldinho's harsh criticism of their mentality ahead of Copa América! True leaders stand by their team no matter what comes their way.;;;26;0;20;Abdulaziz Al;Abdulaziz_maaa;Tech entrepreneur and innovator. Sharing insights on startups, technology, and business growth.;https://images.unsplash.com/photo-1514222709107-a180c68d72b4?q=80&w=3656&auto=format&fit=crop&ixlib=rb-4.0.3&ixid=M3wxMjA3fDB8MHxwaG90by1wYWdlfHx8fGVufDB8fHx8fA%3D%3D;523;0;0;;A_3;21
24;19.06.24 10:07;Lonely Planet's depiction makes me want to book my next trip but let’s not forget that right now parts of beautiful Brazil are suffering greatly from severe flooding crises needing urgent support.;;;26;1;13;Amjad Hussain;AmjadHussain299;Photographer and visual storyteller. Capturing moments and sharing photography tips.;https://images.unsplash.com/photo-1506794778202-cad84cf45f1d?q=80&w=3744&auto=format&fit=crop&ixlib=rb-4.0.3&ixid=M3wxMjA3fDB8MHxwaG90by1wYWdlfHx8fGVufDB8fHx8fA%3D%3D;342;0;0;;A_3;22
